{
  "schema": "xiaozhi-speech-qualification-corpus-v1",
  "corpus_id": "m28-synthetic-harness-v1",
  "consent_class": "synthetic",
  "stt_case": {
    "case_id": "stt-synthetic-tone",
    "sample_rate_hz": 16000,
    "channels": 1,
    "packet_duration_ms": 60,
    "packets_base64": [
      "W0Eq5m/L6fEF2RCrGyG5RwPjcoYZy8DxgXZTmMvaSw8sQZlSFAjLzT4NDWkwz/cMlh//3K8oF6ThU6NCt4eJujv5fnXez4Ftl14ecg8BoDyQQl7HYsaOZ5F3CZNaSDfenBnNCcf4euaGNr1ixYVgwqVGahrDsxIZKBsiKfSf2a7/XOK9BVAdhPmsAAAAAAAAAAAAAAAAAAAAAAAAAAAAAAAAAAAAAAAAAAAAAAAAAAAAAAAA"
    ],
    "expected_text": "synthetic harness accepted"
  },
  "tts_cases": [
    {
      "case_id": "tts-isolation-a",
      "text": "Qualification channel alpha."
    },
    {
      "case_id": "tts-isolation-b",
      "text": "Qualification channel beta has a longer response."
    }
  ],
  "tts_cancel_case": {
    "case_id": "tts-cancel",
    "text": "This qualification response must be cancelled after its first frame."
  }
}
